<?xml version="1.0" encoding="UTF-8" standalone="yes"?>
<!--

    Licensed to Apereo under one or more contributor license
    agreements. See the NOTICE file distributed with this work
    for additional information regarding copyright ownership.
    Apereo licenses this file to you under the Apache License,
    Version 2.0 (the "License"); you may not use this file
    except in compliance with the License.  You may obtain a
    copy of the License at the following location:

      http://www.apache.org/licenses/LICENSE-2.0

    Unless required by applicable law or agreed to in writing,
    software distributed under the License is distributed on an
    "AS IS" BASIS, WITHOUT WARRANTIES OR CONDITIONS OF ANY
    KIND, either express or implied.  See the License for the
    specific language governing permissions and limitations
    under the License.

-->
<event-aggregation
    xmlns="https://source.jasig.org/schemas/uportal/io/event-aggregation"
    xmlns:xsi="http://www.w3.org/2001/XMLSchema-instance"
    xsi:schemaLocation="
        https://source.jasig.org/schemas/uportal/io/event-aggregation https://source.jasig.org/schemas/uportal/io/event-aggregation/event-aggregation-4.0.xsd"
    version="4.0">
     
    <aggregated-group-config>
        <aggregator-type>org.jasig.portal.events.aggr.login.LoginPortalEventAggregator</aggregator-type>
        <exclude>
            <groupService>local</groupService>
            <groupName>Guest</groupName>
        </exclude>
    </aggregated-group-config>
    
    <aggregated-interval-config>
        <aggregator-type>org.jasig.portal.events.aggr.IPortalEventAggregator</aggregator-type>
        <exclude>MINUTE</exclude>
    </aggregated-interval-config>
    
    <quarter-details>
        <id>0</id>
        <start>--01-01</start>
        <end>--04-01</end>
    </quarter-details>
    <quarter-details>
        <id>1</id>
        <start>--04-01</start>
        <end>--07-01</end>
    </quarter-details>
    <quarter-details>
        <id>2</id>
        <start>--07-01</start>
        <end>--10-01</end>
    </quarter-details>
    <quarter-details>
        <id>3</id>
        <start>--10-01</start>
        <end>--01-01</end>
    </quarter-details>
</event-aggregation>
