<?xml version="1.0" encoding="UTF-8" standalone="yes"?>
<!--

    Licensed to Apereo under one or more contributor license
    agreements. See the NOTICE file distributed with this work
    for additional information regarding copyright ownership.
    Apereo licenses this file to you under the Apache License,
    Version 2.0 (the "License"); you may not use this file
    except in compliance with the License.  You may obtain a
    copy of the License at the following location:

      http://www.apache.org/licenses/LICENSE-2.0

    Unless required by applicable law or agreed to in writing,
    software distributed under the License is distributed on an
    "AS IS" BASIS, WITHOUT WARRANTIES OR CONDITIONS OF ANY
    KIND, either express or implied.  See the License for the
    specific language governing permissions and limitations
    under the License.

-->
<event-aggregation
    xmlns="https://source.jasig.org/schemas/uportal/io/event-aggregation"
    xmlns:xsi="http://www.w3.org/2001/XMLSchema-instance"
    xsi:schemaLocation="
        https://source.jasig.org/schemas/uportal/io/event-aggregation https://source.jasig.org/schemas/uportal/io/event-aggregation/event-aggregation-4.0.xsd"
    version="4.0">
    
    <!-- 
     | Only aggregate data for the local.Everyone group to reduce storage requirements
     +-->
    <aggregated-group-config>
        <aggregator-type>org.jasig.portal.events.aggr.IPortalEventAggregator</aggregator-type>
        <include>
            <groupService>local</groupService>
            <groupName>Everyone</groupName>
        </include>
        <include>
            <groupService>local</groupService>
            <groupName>Students</groupName>
        </include>
    </aggregated-group-config>
    
    <!-- 
     | Setup conservative list of included intervals to reduce storage requirements.
     +-->
    <aggregated-interval-config>
        <aggregator-type>org.jasig.portal.events.aggr.concuser.ConcurrentUserAggregator</aggregator-type>
        <include>FIVE_MINUTE</include>
    </aggregated-interval-config>
    <aggregated-interval-config>
        <aggregator-type>org.jasig.portal.events.aggr.login.LoginPortalEventAggregator</aggregator-type>
        <include>FIVE_MINUTE</include>
        <include>HOUR</include>
        <include>DAY</include>
        <include>MONTH</include>
    </aggregated-interval-config>
    <aggregated-interval-config>
        <aggregator-type>org.jasig.portal.events.aggr.portletexec.PortletExecutionAggregator</aggregator-type>
        <include>HOUR</include>
        <include>DAY</include>
        <include>MONTH</include>
    </aggregated-interval-config>
    <aggregated-interval-config>
        <aggregator-type>org.jasig.portal.events.aggr.tabrender.TabRenderAggregator</aggregator-type>
        <include>HOUR</include>
        <include>DAY</include>
        <include>MONTH</include>
    </aggregated-interval-config>
    <aggregated-interval-config>
        <aggregator-type>org.jasig.portal.events.aggr.portletlayout.PortletLayoutAggregator</aggregator-type>
        <include>DAY</include>
        <include>MONTH</include>
    </aggregated-interval-config>
    <aggregated-interval-config>
        <aggregator-type>org.jasig.portal.events.aggr.action.SearchRequestAggregator</aggregator-type>
        <include>FIVE_MINUTE</include>
        <include>HOUR</include>
        <include>DAY</include>
    </aggregated-interval-config>
    <quarter-details>
        <id>0</id>
        <start>--01-01</start>
        <end>--04-01</end>
    </quarter-details>
    <quarter-details>
        <id>1</id>
        <start>--04-01</start>
        <end>--07-01</end>
    </quarter-details>
    <quarter-details>
        <id>2</id>
        <start>--07-01</start>
        <end>--10-01</end>
    </quarter-details>
    <quarter-details>
        <id>3</id>
        <start>--10-01</start>
        <end>--01-01</end>
    </quarter-details>
    
    <!-- Example term configuration data 
    <term-details>
      <name>Fall 2011-2012</name>
      <start>2011-08-29</start>
      <end>2011-12-24</end>
    </term-details>
    <term-details>
      <name>Winter 2011-2012</name>
      <start>2011-12-24</start>
      <end>2012-02-13</end>
    </term-details>
    <term-details>
      <name>Spring 2011-2012</name>
      <start>2012-02-13</start>
      <end>2012-05-21</end>
    </term-details>
    <term-details>
      <name>Summer 2012</name>
      <start>2012-05-21</start>
      <end>2012-08-27</end>
    </term-details>
    <term-details>
      <name>Fall 2012-2013</name>
      <start>2012-08-27</start>
      <end>2012-12-24</end>
    </term-details>
    <term-details>
      <name>Spring 2012-2013</name>
      <start>2012-12-24</start>
      <end>2013-05-20</end>
    </term-details>
    <term-details>
      <name>Summer 2013</name>
      <start>2013-05-20</start>
      <end>2013-08-26</end>
    </term-details>
    <term-details>
      <name>Fall 2013-2014</name>
      <start>2013-08-26</start>
      <end>2013-12-23</end>
    </term-details>
     -->
</event-aggregation>
